<?xml version="1.0" encoding="UTF-8"?>
<lokallag xmlns:xsi="http://www.w3.org/2001/XMLSchema-instance"
          xsi:noNamespaceSchemaLocation="lokallag.xsd">
    <lag>
        <info>
            <navn></navn>
            <lokale></lokale>
            <adresse></adresse>
        </info>
        <leder>
            <navn>
                <fornavn></fornavn>
                <etternavn></etternavn>
            </navn>
        </leder>
        <medlemmer>
            <medlem mId="">
                <navn>
                    <fornavn></fornavn>
                    <etternavn></etternavn>
                </navn>
                <kontakt>
                    <telefon></telefon>
                    <epost></epost>
                </kontakt>
                <adresse>
                    <gateadresse></gateadresse>
                    <postnummer></postnummer>
                    <poststed></poststed>
                </adresse>
                <status></status>
                <avgifter>
                    <avgift>
                        <aar></aar>
                        <betalt></betalt>
                        <dato></dato>
                    </avgift>
                </avgifter>
            </medlem>
        </medlemmer>
    </lag>
</lokallag>